jurisdiction,regime,startYear,endYear,MAT,CD,CU,MOR,PRO,COM,ZS,ONT_H,ONT_S,PF,TRB,ENG,EPS,AES,description
Argentina,Rosas,1830,1852,4,5,4,2,1,1,5,1,3,1,5,4,3,4,"Juan Manuel de Rosas imposed caudillo rule over Buenos Aires with terror and populist federalism, dominating the confederation until his overthrow at Caseros."
Argentina,Liberal Republic,1853,1915,5,3,4,3,4,3,2,4,2,3,2,3,0,0,"The 1853 constitution ushered in an export-led boom fueled by European immigration, making Argentina one of the world's wealthiest nations."
Argentina,Radical/Conservative,1916,1942,3,3,3,3,3,3,3,3,3,4,3,4,1,0,"Yrigoyen's Radical Party brought middle-class democracy, interrupted by the 1930 coup that began the 'Infamous Decade' of conservative fraud."
Argentina,Peronist Era,1943,1955,2,4,2,3,2,1,3,3,3,5,5,5,3,4,"Juan Peron and Eva Peron built justicialismo on organized labor, nationalist industrialization, and mass political mobilization."
Argentina,Instability/Coups,1956,1972,4,4,2,3,2,2,4,1,4,3,4,4,1,4,"A cycle of military coups and weak civilian governments under Aramburu, Frondizi, and Ongania failed to resolve the Peronist question."
Argentina,Dirty War,1973,1983,4,5,5,1,1,1,5,1,5,1,5,4,1,4,"Peron's chaotic return and death gave way to a military junta that waged a 'dirty war' of disappearances, ending with the Falklands defeat."
Argentina,Democratic Restoration,1984,2001,4,2,3,4,4,4,3,3,3,4,2,4,0,0,"Alfonsin restored democracy and tried the junta, while Menem's neoliberal reforms privatized the economy before the 2001 financial collapse."
Argentina,Kirchner Era Argentina,2002,2015,2,3,3,3,2,2,4,3,4,5,4,5,3,4,"Néstor Kirchner stabilized Argentina after the 2001 default with heterodox economics, then his wife Cristina Fernández de Kirchner won two terms on the soybean export boom. Aggressive Peronist populism, extensive nationalization, currency controls, and confrontation with the US holdouts defined the era."
Argentina,Macri-Fernández Oscillation,2015,2023,3,3,3,3,3,3,3,3,3,4,4,5,3,4,"Mauricio Macri's center-right Cambiemos coalition pursued gradualist liberalization and an IMF mega-loan, but inflation and recession ended in defeat. Alberto Fernández with Cristina as VP returned the Peronists to power but failed to control inflation, which spiraled past 100% by 2023."
Argentina,Milei Libertarian Argentina,2023,2026,5,3,3,1,1,1,5,1,1,5,4,5,5,4,"Javier Milei's anarcho-capitalist La Libertad Avanza won an unprecedented insurgent presidency, unleashing radical fiscal shock therapy: ministry abolitions, peso devaluation, subsidy elimination, and dollarization debate. Inflation collapsed but poverty surged in the short term; Milei aligned closely with Trump and Bukele internationally."
Canada,British North America,1789,1866,4,4,3,3,4,4,3,3,2,3,3,3,1,0,Upper and Lower Canada navigated rebellions and the Durham Report before achieving responsible government within the British imperial framework.
Canada,Confederation/Macdonald,1867,1895,4,4,2,2,4,4,3,3,2,4,3,3,1,0,"Confederation united the provinces under Macdonald's National Policy of tariffs, railways, and western settlement, including the residential school system."
Canada,Laurier/Early 20th,1896,1929,4,3,3,3,4,4,3,3,2,4,3,3,1,0,"Wilfrid Laurier presided over a massive immigration boom, while World War I's conscription crisis deepened the English-French divide."
Canada,Depression/War/Postwar,1930,1956,3,3,3,3,4,4,3,3,3,4,3,3,1,0,"The Depression spawned prairie populism and social credit, while World War II and postwar prosperity expanded the federal welfare state."
Canada,Quiet Revolution/Trudeau Sr.,1957,1983,2,2,5,5,5,4,2,4,2,4,2,4,0,0,"Quebec's Quiet Revolution modernized French Canada, and Pierre Trudeau entrenched bilingualism, multiculturalism, and the Charter of Rights and Freedoms."
Canada,Mulroney/Chretien,1984,2005,4,2,4,4,5,4,2,3,2,4,2,3,0,0,"Mulroney pursued free trade and constitutional reform, Chretien eliminated the deficit, and two Quebec sovereignty referendums tested national unity."
Canada,Harper Conservative Canada,2006,2015,4,3,4,3,3,3,3,4,3,4,2,4,0,0,"Stephen Harper's Conservatives ended a decade of Liberal dominance, pursuing tough-on-crime omnibus bills, oil-sands expansion, withdrawal from Kyoto, the elimination of the long-form census, and the Senate-expense scandal. Foreign policy tilted toward Israel and away from multilateralism."
Canada,Trudeau-Carney Liberal Canada,2015,2026,3,2,5,5,4,4,2,3,3,4,2,4,0,0,"Justin Trudeau's Liberals returned with progressive branding (climate carbon tax, immigration expansion, marijuana legalization, Indigenous reconciliation), beset by SNC-Lavalin and the 2022 Freedom Convoy. After Trudeau's January 2025 resignation, Mark Carney won the Liberal leadership and the April 2025 election against Poilievre, pivoting Canada toward defense buildup and confrontation with Trump's tariff war."
Colombia,Gran Colombia/Independence,1810,1830,4,3,3,3,3,2,4,4,4,3,3,4,0,5,"Bolivar liberated New Granada and forged Gran Colombia, but regional rivalries dissolved the union within two decades."
Colombia,Conservative Hegemony,1831,1885,5,5,2,2,3,2,4,2,3,4,4,4,2,4,"Recurring civil wars between Liberals and Conservatives defined the era, with the Church playing a central role in Conservative governance."
Colombia,Regeneration/Thousand Days,1886,1929,5,5,4,2,3,2,4,2,3,4,4,3,2,0,"The Regeneration centralized power under a new constitution, the devastating Thousand Days' War killed over 100,000, and Panama seceded with US backing."
Colombia,Liberal Republic/La Violencia,1930,1957,3,4,2,3,2,1,5,2,5,5,5,5,3,4,"Liberal reforms gave way to La Violencia, a brutal partisan civil war killing 200,000, ended only by military dictatorship."
Colombia,National Front,1958,1973,4,4,2,3,4,5,3,3,3,5,4,3,1,0,"Liberals and Conservatives agreed to alternate power, restoring elite stability but excluding the left and enabling FARC's emergence."
Colombia,Drug War/Constitution,1974,2002,4,3,3,3,3,3,4,2,4,4,4,4,1,4,"The Medellin and Cali cartels unleashed narco-violence, prompting the progressive 1991 constitution amid ongoing guerrilla and paramilitary conflict."
Colombia,Uribe Security Era,2003,2010,4,4,2,2,2,2,5,1,3,5,4,4,0,4,"Álvaro Uribe's 'democratic security' approach weakened FARC militarily through the U.S.-backed Plan Colombia, demobilized paramilitary AUC structures (controversially), and reasserted state presence across rural territory. The hardline approach produced security gains alongside extrajudicial-killing scandals (the 'falsos positivos')."
Colombia,Santos Peace Process,2010,2018,3,3,3,4,4,5,2,3,3,4,3,4,0,0,"Juan Manuel Santos broke with Uribe to negotiate a historic peace deal with FARC, narrowly defeated by plebiscite in 2016 then ratified through Congress after revisions. Santos won the 2016 Nobel Peace Prize but the peace deal split Colombian politics and energized the Uribista right."
Colombia,Duque-Petro Polarization,2018,2026,3,2,3,3,3,2,3,3,3,5,4,4,0,0,"Iván Duque's Uribista presidency partially obstructed the peace deal's implementation; the 2021 'paro nacional' protests exposed deep social discontent. Gustavo Petro became Colombia's first leftist president in 2022 with the M-19 ex-guerrilla as the political base, pursuing 'total peace' negotiations and tax/health reform amid intense opposition."
Chile,Independence/O'Higgins,1810,1830,4,3,2,3,3,2,3,3,4,3,3,4,0,5,Bernardo O'Higgins led Chile's liberation from Spain and established an autocratic republic before being forced into exile.
Chile,Conservative Republic,1831,1860,5,5,4,2,4,2,3,2,1,3,4,3,1,0,Diego Portales designed a centralized authoritarian constitution that delivered exceptional stability and fueled mining-driven economic growth.
Chile,Liberal Republic,1861,1924,5,3,3,3,4,4,3,3,2,4,3,3,0,0,"Parliamentary politics and the War of the Pacific secured nitrate-rich territories, driving export wealth and liberal institutional development."
Chile,Social Question,1925,1958,3,3,3,3,3,3,3,3,3,4,3,4,1,0,"A new constitution, Ibanez's interventionism, and Popular Front coalitions addressed growing labor demands and social inequality."
Chile,Christian Democracy/Left,1959,1972,1,2,4,4,3,2,3,5,4,5,3,5,0,5,Eduardo Frei's 'Revolution in Liberty' was overtaken by Salvador Allende's democratic socialist experiment under Unidad Popular.
Chile,Pinochet,1973,1989,5,5,5,1,1,1,5,1,3,1,4,3,0,4,Augusto Pinochet's military dictatorship crushed the left through systematic repression while Chicago Boys economists imposed radical free-market reforms.
Chile,Concertacion,1990,2009,3,2,4,4,5,5,2,4,2,4,2,4,0,0,"The center-left Concertacion coalition managed a model democratic transition, maintaining market economics while building consensus and a copper stabilization fund."
Chile,Estallido/Boric,2010,2025,2,2,4,4,3,3,3,3,4,4,3,5,0,5,"Mass protests against inequality in 2019 launched a constitutional rewrite process, and Gabriel Boric's young left government sought transformative reform."
Chile,Kast Conservative Turn,2026,2026,4,5,2,2,3,2,4,2,3,4,4,5,1,4,"Jose Antonio Kast's 2026 inauguration marked Chile's sharpest post-dictatorship move to the right, centered on public security, border control, fiscal discipline, and a backlash against the failed constitutional-reform cycle that began after the 2019 estallido."
Cuba,Spanish Colony,1789,1897,5,5,5,1,2,1,5,1,3,2,5,3,2,0,"Cuba remained Spain's prized sugar colony sustained by African slavery, with periodic independence movements brutally suppressed."
Cuba,US Intervention/Platt,1898,1932,5,4,2,2,3,3,4,2,3,3,3,3,1,0,"The Spanish-American War brought nominal independence under the Platt Amendment, making Cuba a US protectorate dependent on sugar exports."
Cuba,Batista/Republic,1933,1958,5,4,2,2,2,2,4,2,3,2,3,3,1,0,"Batista dominated Cuban politics through coups and elections, presiding over Havana's modernization and Mafia-linked corruption before Castro's revolution."
Cuba,Revolutionary Cuba,1959,1975,1,2,2,4,1,1,4,5,5,1,4,5,4,5,"Fidel Castro's revolution nationalized the economy and aligned with the Soviet Union, surviving the Bay of Pigs invasion and the Missile Crisis."
Cuba,Late Castro/Special Period,1976,2006,1,3,4,3,2,1,4,3,3,1,4,4,1,4,"Institutionalized socialism faced catastrophic economic crisis when Soviet support collapsed, forcing limited market experiments during the Special Period."
Cuba,Post-Castro,2007,2026,2,3,2,3,2,2,4,2,3,1,4,3,1,0,Raul Castro and Diaz-Canel introduced limited economic reforms while maintaining one-party control amid growing emigration and social discontent.
Peru,Colonial/Independence,1789,1824,5,5,4,1,2,1,5,2,4,2,5,3,2,0,Peru was Spain's most important South American viceroyalty; Tupac Amaru's rebellion and Bolivar's campaigns finally ended colonial rule.
Peru,Caudillo Era,1825,1878,5,4,2,2,2,2,4,2,3,3,4,3,1,4,"Military strongmen competed for power during the guano boom, which briefly enriched the state before the disastrous War of the Pacific."
Peru,Aristocratic Republic,1879,1919,5,4,2,2,3,3,3,2,2,3,4,3,1,0,"After defeat in the War of the Pacific, a coastal oligarchy rebuilt the state through the Civilista Party and export-oriented growth."
Peru,Leguia/APRA,1920,1967,3,4,2,3,2,2,3,3,3,3,4,4,1,4,"Leguia's modernizing autocracy gave way to military-civilian oscillation, with APRA's populist movement repeatedly blocked from power."
Peru,Velasco/Military,1968,1979,1,3,3,3,2,1,3,3,4,1,4,4,1,4,General Velasco's left-wing military government nationalized industries and enacted sweeping agrarian reform to dismantle the oligarchy.
Peru,Democracy/Fujimori,1980,2000,4,3,2,3,2,2,4,1,4,3,4,4,1,4,Democracy returned amid Sendero Luminoso's Maoist insurgency; Fujimori's autogolpe crushed the guerrillas but installed authoritarian neoliberalism.
Peru,Post-Fujimori,2001,2026,3,3,3,3,3,3,3,2,4,4,3,4,3,3,Chronic presidential instability and Pedro Castillo's chaotic tenure deepened institutional crisis in one of Latin America's most fragile democracies.
Venezuela,Independence/Gran Colombia,1810,1830,4,3,3,3,2,2,4,4,4,3,3,4,0,5,"Venezuela was the birthplace of Bolivar's independence movement and Gran Colombia, but internal divisions soon tore the federation apart."
Venezuela,Caudillo Era,1831,1908,5,4,2,2,1,1,5,2,3,2,4,3,3,4,"From Paez to the Federal War and beyond, Venezuela endured decades of caudillo rule and civil conflict with minimal institutional development."
Venezuela,Gomez/Oil State,1909,1957,5,4,2,2,2,1,4,2,2,1,4,2,1,4,Juan Vicente Gomez's long dictatorship coincided with massive oil discoveries that transformed Venezuela into a petro-state under military modernizers.
Venezuela,Punto Fijo Democracy,1958,1988,3,3,3,3,4,5,2,3,2,5,3,4,1,0,"The Punto Fijo pact between AD and COPEI delivered stable two-party democracy funded by oil wealth, becoming a model for Latin American governance."
Venezuela,Crisis/Caracazo,1989,1998,4,3,3,3,3,3,4,2,5,3,3,4,1,3,"Neoliberal austerity triggered the deadly Caracazo riots and two failed coup attempts by Hugo Chavez, collapsing public trust in the old parties."
Venezuela,Chavez,1999,2012,1,3,3,3,1,1,4,4,5,5,5,5,3,4,"Hugo Chavez's Bolivarian Revolution redistributed oil wealth, rewrote the constitution, and polarized society between chavistas and the opposition."
Venezuela,Maduro,2013,2026,1,4,4,2,1,1,5,2,4,1,5,4,5,4,"Nicolas Maduro's regime presided over economic collapse, mass emigration, and authoritarian consolidation amid a devastating humanitarian crisis."
Argentina,Rio de la Plata Colonial,1789,1809,5,4,3,2,3,2,4,2,3,2,4,3,1,0,"The Viceroyalty of the Rio de la Plata remained a Spanish imperial-commercial order centered on Buenos Aires, cattle exports, contraband trade, and crown bureaucracy. Creole elites were growing in confidence, but political authority still flowed through monarchy, church, and imperial law before the May Revolution."
Chile,Captaincy of Chile,1789,1809,5,4,3,2,3,2,4,2,3,2,4,3,1,0,"Late colonial Chile was a Spanish captaincy shaped by frontier militarization, landed estates, Catholic hierarchy, and persistent Mapuche resistance south of the Bio-Bio. Bourbon reform strengthened administration, but local creole elites and militia institutions formed the substrate for independence politics."
Colombia,New Granada Colonial,1789,1809,5,4,3,2,3,2,4,2,3,2,4,3,1,0,"The Viceroyalty of New Granada linked Andean cities, Caribbean ports, mining zones, and frontier missions under Spanish Bourbon administration. Social hierarchy, Catholic corporatism, regionalism, and creole resentment framed politics before the independence juntas."
Venezuela,Captaincy General of Venezuela,1789,1809,5,4,3,2,3,2,4,2,3,2,4,3,1,0,"Spanish Venezuela was organized around cacao plantations, slavery, regional elites, and the Captaincy General created by Bourbon reform. Caracas creole politics, coastal commerce, and stark racial hierarchy made the colony especially volatile as Atlantic revolutions undermined imperial legitimacy."
China,Late Qing/Pre-Opium,1789,1839,4,5,5,2,3,2,3,2,2,1,4,2,2,0,"Late Qing dynasty under Confucian bureaucratic order. The Qianlong Emperor's long reign gave way to gradual decline, with the Canton system tightly controlling foreign trade. The imperial examination system and Confucian orthodoxy remained unchallenged, but corruption and population pressure were building beneath a veneer of stability."
China,Opium Wars/Taiping,1840,1864,4,5,4,2,2,1,5,2,5,2,4,4,2,4,"The Century of Humiliation began with British victory in the First Opium War and the Treaty of Nanjing. The Taiping Rebellion devastated southern China with tens of millions killed. Unequal treaties forced open ports and extraterritoriality, shattering the Sinocentric world order and creating a deep sense of civilizational crisis."
China,Self-Strengthening/Reform,1865,1911,4,4,2,3,3,2,4,3,4,3,4,4,1,5,"The Tongzhi Restoration and Self-Strengthening Movement attempted to graft Western technology onto Confucian foundations. The Hundred Days Reform failed, the Boxer Rebellion brought further humiliation, and the abolition of the examination system removed a key pillar of imperial legitimacy. The Xinhai Revolution of 1911 finally toppled the dynasty."
China,Republic/Warlords,1912,1927,3,3,3,3,2,2,5,3,5,4,4,5,0,5,"Sun Yat-sen's republic quickly gave way to Yuan Shikai's autocracy and then warlord fragmentation. The May Fourth Movement introduced radical new ideologies. Competing visions of modernity clashed as Nationalists and Communists both organized, briefly cooperating in the First United Front before Chiang Kai-shek's Northern Expedition."
China,Nanjing Decade/War,1928,1948,4,4,2,3,2,1,5,2,5,1,5,5,1,4,"The KMT under Chiang Kai-shek attempted state-building while fighting Communists and then Japan. The Nanjing Decade saw partial modernization but failed land reform. Japanese invasion from 1937 devastated the country, and the subsequent civil war between Nationalists and Communists consumed the nation in total mobilization."
China,Mao Early,1949,1957,1,4,5,4,1,1,5,5,5,5,4,5,4,5,"The People's Republic launched sweeping land reform, collectivization, and the Korean War. The new regime combined Marxist universalism with Chinese nationalism in a revolutionary synthesis. The Hundred Flowers Campaign briefly invited criticism before the Anti-Rightist crackdown revealed the limits of permitted discourse."
China,Mao Radical,1958,1976,1,5,5,3,1,1,5,5,5,5,5,5,3,4,"The Great Leap Forward caused catastrophic famine killing tens of millions. The Cultural Revolution unleashed ideological purism, destroying institutions, persecuting intellectuals, and pitting citizens against each other in loyalty campaigns. Mao's cult of personality reached its zenith while the country endured radical social engineering."
China,Deng Reform,1977,1989,4,4,2,3,2,3,3,3,3,2,3,3,0,1,"Deng Xiaoping's pragmatic reforms introduced Special Economic Zones, household responsibility, and opening to the West. 'Reform and opening up' prioritized economic growth over ideological purity. The era ended with the Tiananmen Square protests and crackdown of 1989, which defined the limits of political reform."
China,Jiang/Hu Technocratic,1990,2012,4,4,2,3,3,3,3,3,2,3,3,3,0,1,"Technocratic governance under Jiang Zemin and Hu Jintao delivered extraordinary economic growth, WTO accession, and rising global integration. The 'harmonious society' doctrine smoothed over growing inequality. Collective leadership, term limits, and consensus decision-making became institutional norms within one-party rule."
China,Xi Jinping,2013,2026,3,5,5,2,2,1,4,2,3,5,5,4,1,4,"Xi Jinping consolidated personal power, abolished term limits, and launched anti-corruption campaigns that doubled as political purges. The Belt and Road Initiative projected global ambition while wolf warrior diplomacy signaled assertiveness. Common prosperity rhetoric accompanied crackdowns on tech firms and a return to ideological discipline."
Taiwan,Dutch-Zheng Frontier,1624,1683,4,3,2,2,2,1,4,3,4,2,4,4,1,5,"Early colonial and Ming-loyalist Taiwan. Dutch East India Company rule in southwestern Taiwan built a trade, missionary, and tax regime, while Spanish footholds in the north were short-lived. Zheng Chenggong expelled the Dutch in 1662 and his heirs used Taiwan as a Ming restoration base until Qing conquest in 1683."
Taiwan,Qing Frontier Taiwan,1684,1894,4,4,3,2,3,2,4,2,4,2,4,3,2,0,"Taiwan under Qing rule remained a volatile settler frontier for much of the period, with Han migration, Indigenous displacement, lineage conflict, and repeated uprisings. Qing administration deepened over time and Taiwan became a province in 1885, but imperial authority remained thinner than in the mainland core until the island was ceded after the First Sino-Japanese War."
Taiwan,Japanese Suppression,1895,1915,4,4,4,1,2,1,5,2,4,3,5,4,1,4,"After the Treaty of Shimonoseki ceded Taiwan to Japan, the early colonial state ruled through military pacification and a powerful governor-general. Armed resistance, including the short-lived Republic of Formosa and later uprisings, was suppressed while Japan began building the police, cadastral, transport, and public-health machinery of colonial rule."
Taiwan,Japanese Assimilation,1916,1936,4,4,3,2,3,2,3,3,2,2,4,3,1,0,"The middle colonial period shifted from open military suppression toward developmental and assimilationist rule. Japanese administrators expanded education, transport, irrigation, sugar production, and public health, while Taiwanese remained colonial subjects without equal political status. Petition movements and local associations pressed for representation inside a tightly bounded imperial order."
Taiwan,Wartime Kominka,1937,1945,2,5,5,1,1,1,5,2,5,5,5,5,3,4,"Japan's wartime kominka movement sought to turn Taiwanese subjects into imperial Japanese through language, Shinto, name-changing, military labor, and mobilization for total war. Taiwan became a strategic military and industrial base for Japan's southern advance, tying social life to the demands of empire and war."
Taiwan,ROC Retrocession/228,1945,1948,4,4,2,2,1,1,5,2,5,2,5,5,1,4,"Taiwan was placed under Republic of China administration after Japan's defeat. The transition from Japanese colonial institutions to Nationalist rule brought inflation, corruption, legal confusion, and social distrust. The 1947 February 28 Incident and subsequent repression marked the decisive rupture between many Taiwanese and the incoming mainland administration."
Taiwan,KMT Martial Law State,1949,1974,3,4,4,2,2,1,5,2,4,5,5,4,1,4,"After losing the mainland civil war, the Republic of China government retreated to Taiwan and ruled under martial law. The KMT fused anti-communist mobilization, land reform, one-party discipline, mainland-recovery legitimacy, and White Terror repression. U.S. security backing and state-guided development helped produce rapid growth inside an authoritarian Cold War fortress."
Taiwan,Taiwanization/Liberalizing KMT,1975,1986,4,3,3,3,3,2,4,3,3,4,4,4,1,1,"Chiang Ching-kuo's era combined continuing martial-law controls with Taiwanization, technocratic development, and cautious political opening. International recognition shifted toward Beijing, forcing the regime to lean more on domestic legitimacy. Opposition organizing grew despite repression, culminating in the formation of the Democratic Progressive Party in 1986."
Taiwan,Democratic Transition,1987,1999,3,2,2,4,4,4,3,4,3,4,3,5,0,5,"Martial law was lifted in 1987 and Taiwan moved through rapid democratization: opposition parties, press freedom, retirement of lifetime mainland legislators, constitutional revisions, and direct presidential elections in 1996. Lee Teng-hui localized the ROC state while cross-strait missile intimidation made democratic sovereignty a mass political question."
Taiwan,Party Alternation/Cross-Strait Opening,2000,2015,3,2,2,4,4,3,3,4,3,4,4,4,0,1,"Chen Shui-bian's 2000 victory ended five decades of KMT presidential rule and normalized party alternation. Taiwan deepened pluralist democracy while economic ties with China expanded, especially under Ma Ying-jeou. Cross-strait identity, corruption politics, trade dependence, and youth-led protest shaped the balance between openness and sovereignty anxiety."
Taiwan,Sovereignty Democracy,2016,2026,3,2,2,4,4,3,4,4,4,5,4,5,0,1,"The Tsai Ing-wen and Lai Ching-te era centers Taiwan as a consolidated democracy under intensifying pressure from the People's Republic of China. Same-sex marriage, transitional justice, semiconductor strategy, pandemic governance, defense reform, and closer ties with other democracies coexist with polarization over sovereignty, China policy, and national identity."
Japan,Late Tokugawa,1789,1853,3,5,5,2,4,3,3,2,2,1,5,2,2,0,"The sakoku policy of near-total isolation continued under the Tokugawa shogunate, with tightly regulated trade through Nagasaki. Internal reforms under various domains addressed economic stress, but the rigid status system remained. A flourishing urban culture masked underlying fiscal and social pressures that would soon erupt."
Japan,Bakumatsu/Restoration,1854,1877,4,4,2,3,3,2,4,3,5,3,5,5,0,5,"Perry's Black Ships forced Japan open, triggering the collapse of the Tokugawa order. The sonnō jōi movement, Boshin War, and Meiji Restoration transformed Japan from feudal shogunate to centralized modern state. Samurai rebels and modernizers clashed over the nation's direction in a period of extraordinary upheaval."
Japan,Meiji,1878,1912,4,4,4,3,4,3,4,3,2,3,5,4,0,0,"Japan's rapid modernization combined Western institutions with Japanese traditions under the slogan 'rich country, strong army.' The Meiji Constitution established Asia's first parliamentary system while preserving imperial sovereignty. Victories over China and Russia announced Japan as a great power and imperial competitor."
Japan,Taishō Democracy,1913,1930,3,3,3,3,4,4,3,3,2,4,3,4,0,0,"Party government, universal male suffrage, and liberal cosmopolitanism flourished during the Taishō era. Urbanization and mass culture transformed society while labor movements and women's organizations gained ground. Japan participated in international institutions and the Washington Treaty system, embracing cooperative diplomacy."
Japan,Militarist Japan,1931,1945,2,5,5,1,1,1,5,2,4,5,5,5,3,4,"The Manchurian Incident began Japan's slide into ultranationalist militarism. The Greater East Asia Co-Prosperity Sphere cloaked imperial conquest in pan-Asian rhetoric. Total war mobilization, state Shinto ideology, and the suppression of all dissent culminated in catastrophic defeat and atomic devastation."
Japan,Occupation/Recovery,1946,1959,3,2,3,4,4,4,2,4,4,3,2,4,0,0,"The American occupation under MacArthur imposed a pacifist constitution, land reform, zaibatsu dissolution, and women's suffrage. Japan embraced democratic norms and economic reconstruction with remarkable speed. The reverse course during the Korean War shifted emphasis toward anti-communism and economic recovery."
