jurisdiction,regime,startYear,endYear,MAT,CD,CU,MOR,PRO,COM,ZS,ONT_H,ONT_S,PF,TRB,ENG,EPS,AES,description
Romania,Organic Statutes/Union,1830,1866,4,4,2,3,3,3,3,3,4,3,4,4,1,5,"Russian-imposed Organic Statutes modernized governance in Wallachia and Moldavia, and Alexandru Ioan Cuza unified the principalities in 1859 before being forced to abdicate in favor of a foreign prince."
Romania,Romanian Kingdom,1867,1913,5,4,2,2,3,3,3,2,3,3,4,3,1,0,"Under Carol I, Romania gained full independence and developed as a constitutional monarchy with a landowning oligarchy, while the unresolved peasant question erupted in the massive 1907 revolt."
Romania,Greater Romania,1914,1937,4,4,2,3,3,3,3,3,3,5,4,4,1,0,"WWI brought the unification of Transylvania, Bessarabia, and Bukovina into Greater Romania, but interwar democracy proved fragile as ethnic tensions, land reform, and the rise of the fascist Iron Guard destabilized the state."
Romania,Royal Dictatorship/WWII,1938,1944,4,5,5,1,1,1,5,1,5,4,5,5,3,4,"Carol II's royal dictatorship gave way to Marshal Antonescu's alliance with Nazi Germany, leading Romania into the invasion of the USSR, the Holocaust in Transnistria, and eventual capitulation to the Soviets in August 1944."
Romania,Communist Romania,1945,1964,1,4,5,3,1,1,4,4,3,5,4,4,1,1,"Soviet-backed communists seized power, abolished the monarchy, collectivized agriculture, and industrialized under Gheorghiu-Dej while purging rivals and imprisoning hundreds of thousands in forced labor camps."
Romania,Ceausescu,1965,1989,1,5,5,2,1,1,5,3,2,5,5,4,3,4,"Nicolae Ceausescu built a nationalist communist personality cult, pursuing an independent foreign policy while imposing devastating austerity to repay foreign debt, banning abortion, and demolishing villages for systematization."
Romania,Iliescu Transition,1990,2004,3,3,3,3,2,3,3,4,4,4,3,4,3,4,"The violent 1989 revolution gave way to disputed transition under Iliescu, including the mineriad violence against student protesters, slow market reform, and chronic corruption. Politics was dominated by ex-communist FSN/PDSR networks while a fragmented liberal opposition struggled."
Romania,EU Accession Romania,2004,2014,4,3,3,3,4,4,3,3,4,4,3,4,1,0,"Băsescu's center-right governments completed EU accession in 2007, established the DNA anti-corruption agency, and consolidated NATO ties. Anti-corruption became a defining cleavage and the bedrock of pro-EU technocratic governance."
Romania,Iohannis-era Romania,2014,2026,4,3,3,3,4,3,3,3,4,4,4,4,1,0,Klaus Iohannis's two presidential terms institutionalized the anti-corruption posture against PSD pushback (the 2017 protest wave). PSD-led governments alternated with PNL-led grand coalitions; the AUR ultranationalist-populist party rose from nothing to second place by the 2024 elections.
Hungary,Habsburg Hungary,1789,1847,4,4,2,3,3,3,3,3,3,3,4,3,1,5,"Hungarian reform nobles like Szechenyi and Kossuth pushed for modernization and Magyar language rights within the Habsburg framework, setting the stage for the revolutionary explosion of 1848."
Hungary,1848/Compromise,1848,1867,3,4,2,3,3,3,4,3,4,4,5,5,1,4,The 1848 revolution proclaimed liberal Hungarian self-governance before Russian intervention crushed it; decades of passive resistance culminated in the 1867 Ausgleich that created the Dual Monarchy.
Hungary,Dual Monarchy,1868,1918,4,4,5,2,3,3,3,3,2,4,5,4,1,0,"As co-equal partner in Austria-Hungary, the Magyar elite pursued aggressive Magyarization of minorities while industrializing Budapest into a major European capital, before WWI destroyed the empire."
Hungary,Horthy Era,1920,1944,4,5,5,2,2,2,5,1,4,3,5,4,2,4,"Admiral Horthy's regency was defined by irredentist revisionism after the Treaty of Trianon, the White Terror against leftists, and a gradual slide into the Nazi orbit that ended with German occupation and the Holocaust."
Hungary,Stalinist Hungary,1945,1956,1,4,5,3,1,1,4,4,3,5,4,4,1,1,"Matyas Rakosi's Stalinist regime imposed terror, show trials, and forced industrialization before the 1956 Hungarian Revolution briefly overthrew communist rule, only to be crushed by Soviet tanks."
Hungary,Kadar Era,1957,1989,2,3,2,3,2,3,3,3,2,1,3,2,1,0,"Janos Kadar's 'goulash communism' traded political conformity for consumer goods and the New Economic Mechanism, making Hungary the most liberal Warsaw Pact state and a bridge between East and West."
Hungary,Post-Communist/Liberal,1990,2009,4,2,3,4,4,4,2,4,3,4,2,4,0,0,"Hungary's negotiated transition was hailed as a democratic success story, with EU and NATO accession, market reforms, and a functioning multi-party system alternating between left and right coalitions."
Hungary,Orban's Hungary,2010,2026,3,5,4,2,2,1,4,1,4,5,5,5,3,4,"Viktor Orban's Fidesz built an 'illiberal democracy' with a constitutional supermajority, capturing state institutions, media, and courts while championing Christian nationalism and anti-immigration politics within the EU."
Czech/Czechoslovakia,Habsburg Bohemia,1789,1867,4,4,2,3,3,3,3,3,3,3,4,3,1,0,"The Czech national revival within the Habsburg Empire fostered linguistic and cultural consciousness, with the 1848 Prague uprising marking an early but unsuccessful bid for Slavic autonomy within the monarchy."
Czech/Czechoslovakia,Austria-Hungary/Czech Politics,1868,1918,3,3,3,3,4,3,3,3,3,4,4,4,0,0,"Czech political parties flourished within Austria-Hungary's parliamentary system, with Young Czechs and Social Democrats competing alongside Tomas Masaryk's Realist movement that would lead to independence."
Czech/Czechoslovakia,First Republic,1918,1938,3,2,4,4,5,4,2,4,2,4,2,4,0,0,"Masaryk's Czechoslovakia was interwar Central Europe's only stable democracy, with a strong industrial base, progressive constitution, and commitment to minority rights, though Sudeten German grievances festered."
Czech/Czechoslovakia,Munich/Protectorate,1938,1945,3,5,5,1,1,1,5,1,5,1,5,5,3,4,"The Munich Agreement dismembered Czechoslovakia, and the subsequent Nazi Protectorate of Bohemia and Moravia imposed terror, Germanization, and the destruction of Lidice, while the Sudeten Germans were expelled after liberation."
Czech/Czechoslovakia,Communist Czechoslovakia,1948,1967,1,4,5,3,1,1,4,4,3,5,4,4,1,1,"The 1948 communist coup imposed Stalinist rule under Gottwald with show trials, collectivization, and heavy industrialization, while Czechoslovakia became one of the most rigidly orthodox Warsaw Pact states."
Czech/Czechoslovakia,Prague Spring/Normalization,1968,1989,1,3,2,3,2,2,4,3,4,4,3,3,1,0,"Dubcek's 'socialism with a human face' was crushed by Warsaw Pact invasion in August 1968, ushering in two decades of Husak's normalization that enforced conformity while dissidents like Havel kept civic ideals alive."
Czech/Czechoslovakia,Klaus Reform Era,1993,2004,5,3,3,3,4,4,3,3,2,4,2,4,0,0,"After the Velvet Divorce from Slovakia, Václav Klaus pursued rapid market reforms — voucher privatization, currency stabilization, EU pre-accession — while Václav Havel served as the conscience-presidency counterweight. Czech politics polarized between Klaus's pragmatic right and a fragmented social-democratic and Christian-democratic opposition."
Czech/Czechoslovakia,EU Accession Czech Republic,2004,2017,4,3,3,3,4,4,2,3,2,3,2,3,0,0,"EU and NATO membership institutionalized a multiparty parliamentary democracy with regular alternation between ODS and ČSSD-led coalitions. The financial crisis, austerity politics, and corruption scandals shaped a stable but increasingly cynical electorate."
Czech/Czechoslovakia,Babiš-era Czech Republic,2017,2026,3,3,3,3,3,3,3,3,2,4,3,4,0,0,"Andrej Babiš's ANO movement displaced traditional parties, governing as a billionaire-led catch-all populist force, with Miloš Zeman the Russia-friendly Castle counterweight. The 2021 SPOLU coalition under Fiala restored a center-right pro-EU government and led the Western response to the Ukraine war; Babiš and ANO returned to first place in 2025."
Belgium,Austrian/French/Dutch Netherlands,1789,1829,4,4,3,3,3,3,3,3,3,3,3,3,1,0,"The territory that became Belgium moved from Austrian Habsburg rule through Brabant revolutionary unrest, French annexation, and the post-1815 United Kingdom of the Netherlands. Catholic, French-speaking, and industrial southern interests increasingly clashed with Dutch Protestant and northern commercial rule before the Belgian Revolution."
Denmark,Absolutist Denmark-Norway,1789,1814,4,4,3,3,3,3,3,3,2,2,3,3,1,0,"Late absolutist Denmark-Norway combined Lutheran monarchy, mercantilist administration, agrarian reform, and imperial trade, before the Napoleonic Wars cost Denmark Norway and exposed the limits of small-state neutrality."
Denmark,Constitutional Denmark,1815,1944,3,3,3,4,4,4,2,4,2,3,2,3,0,0,"Denmark moved from absolutism to constitutional monarchy in 1849, lost Schleswig-Holstein after national conflict, and built a cooperative agrarian-liberal society with folk high schools, parliamentary development, and neutrality until German occupation in 1940."
Denmark,Postwar Welfare Buildout Denmark,1945,1973,1,2,3,5,5,5,1,5,1,4,2,4,0,1,"Postwar Denmark joined NATO, adopted the 1953 constitution, and built a universal welfare state under Social Democratic dominance with broad cross-party consensus. Strong unions, the cooperative movement, and parliamentary deliberation defined a high-trust corporatist political culture."
Denmark,Late Welfare State Denmark,1973,2000,3,2,3,4,5,5,2,4,1,4,2,4,0,1,"The 1973 'earthquake election' brought Glistrup's anti-tax Progress Party into parliament, ending the postwar party system. Oil shocks, growing budget deficits, EU enlargement, and the early 1990s welfare reforms reshaped Denmark while preserving the universal welfare model."
Denmark,Contemporary Denmark,2001,2026,3,3,3,4,5,4,2,4,2,4,3,4,0,0,"The Danish People's Party and later right-populist pressures made immigration and national identity central to an otherwise high-trust welfare democracy. Denmark remains institutionally strong, EU-cautious, socially liberal, and increasingly assertive on integration and security."
Finland,Swedish/Russian Grand Duchy,1789,1916,4,4,3,3,4,3,3,3,3,3,3,3,1,0,"Finland passed from Swedish rule to autonomous grand duchy inside the Russian Empire in 1809. Lutheran institutions, estates, language politics, and later Russification shaped a cautious constitutional nationalism before independence."
Finland,Independence/War Finland,1917,1945,4,4,3,3,3,2,5,3,4,5,5,5,1,4,"Independence in 1917 was followed by civil war, conservative republican consolidation, the Winter War, Continuation War, and a hard peace with the Soviet Union. National survival, anti-communism, and disciplined mobilization dominated politics."
Finland,Finlandization/Welfare State,1946,1994,2,3,3,4,5,5,2,4,2,4,2,4,0,1,"Cold War Finland balanced democratic capitalism and Nordic welfare building with careful neutrality toward the Soviet Union. Consensus, presidential diplomacy, social partnership, and institutional discipline defined the Finlandization era."
Finland,EU-Era Neutral Finland,1995,2022,2,2,3,4,5,5,2,4,2,3,2,4,0,0,"EU membership in 1995 anchored Finland in Western institutions while Cold War-era neutrality vis-à-vis Russia continued, complemented by Nokia-led technology growth and a high-trust welfare-state model. Successive coalitions across the political spectrum maintained consensus politics."
Finland,NATO Finland,2022,2026,2,3,3,4,5,4,4,4,2,4,3,5,0,1,"Russia's full invasion of Ukraine in 2022 ended decades of careful Finnish neutrality; NATO membership followed in 2023 with broad cross-party consensus. The Finland-Russia border was effectively closed, defense spending surged, and security politics replaced neutrality as the organizing frame."
Ireland,Union Ireland,1789,1915,4,4,3,3,3,2,4,3,4,4,4,4,1,3,"Ireland under British rule moved from Protestant Ascendancy and rebellion through the Act of Union, Catholic emancipation, famine, land agitation, and Home Rule politics. Catholic-national grievance and imperial constitutional politics existed in constant tension."
Ireland,Revolution/Free State,1916,1937,3,4,3,3,3,2,4,3,4,5,4,5,1,4,"The Easter Rising, War of Independence, Anglo-Irish Treaty, partition, and civil war produced the Irish Free State. Revolutionary nationalism hardened into constitutional state-building under Catholic social norms and fiscal caution."
Ireland,De Valera Republic,1938,1972,4,5,3,3,4,3,3,3,3,4,4,3,2,0,"De Valera's Ireland emphasized sovereignty, neutrality, Catholic social teaching, cultural nationalism, and economic protectionism. The republic remained democratic but socially conservative and economically constrained until gradual opening in the 1960s."
Ireland,EEC Modernization Ireland,1973,1990,3,3,4,3,4,4,3,4,3,4,3,4,0,1,"EEC membership in 1973 began Ireland's slow integration into European structures, with structural funds gradually transforming infrastructure. The Northern Ireland Troubles, fiscal crisis of the 1980s, emigration, and church-state battles over divorce and contraception defined a still-traditional society in slow modernization."
Ireland,Celtic Tiger Ireland,1990,2008,5,2,4,4,5,4,2,4,2,4,2,4,0,1,"Foreign direct investment, low corporate tax, and the IT/pharma boom transformed Ireland into one of Europe's fastest-growing economies. Social liberalization (divorce 1995, decriminalization of homosexuality), the Good Friday Agreement (1998), and rapid secularization weakened the older nationalist-Catholic framework."
Ireland,Post-Crisis Liberal Ireland,2009,2026,3,2,4,5,5,4,2,4,2,4,2,4,0,1,"After the financial crash and austerity, Ireland consolidated a socially liberal, EU-integrated identity through referendums on marriage equality and abortion. Housing, immigration, Northern Ireland, and multinational-tax dependence now define political stress inside a high-institutional-trust democracy."
Norway,Danish/Swedish Union Norway,1789,1904,3,3,3,4,4,4,2,4,2,3,2,3,0,0,"Norway moved from Danish rule to union with Sweden in 1814 while preserving a liberal constitution and strong local institutions. Rural egalitarianism, Lutheran culture, maritime commerce, and constitutional nationalism shaped politics before full independence."
Norway,Independent Norway,1905,1944,3,3,3,4,4,4,3,4,3,4,3,4,0,0,"After peaceful separation from Sweden in 1905, Norway built a parliamentary constitutional monarchy, widened suffrage, and remained oriented toward social reform and maritime trade before Nazi occupation forced an exile-and-resistance wartime order."
Norway,Labor/Oil Welfare State,1945,1989,2,2,3,4,5,5,1,4,1,4,2,4,0,1,"Postwar Labor dominance, NATO membership, oil discovery, and corporatist bargaining built a wealthy Nordic welfare state. Norway combined high institutional trust, social equality, pragmatic resource nationalism, and cautious non-EU internationalism."
Norway,Contemporary Norway,1990,2026,2,2,3,4,5,4,2,4,1,4,2,4,0,1,"Contemporary Norway remains a high-trust welfare monarchy with oil-fund capitalism, EU-outsider integration through the EEA, and increasing debates over immigration, climate, Arctic security, and petroleum dependence."
Bulgaria,Ottoman Bulgaria,1789,1877,4,4,3,2,3,2,4,2,4,3,4,3,2,0,"Bulgarian lands remained under Ottoman rule, with Orthodox communal institutions, agrarian society, and national revival movements building language, church, and school networks before the Russo-Turkish War created autonomous Bulgaria."
Bulgaria,Principality/Kingdom,1878,1943,4,4,3,2,3,2,4,2,4,4,5,4,1,4,"Autonomous and then independent Bulgaria pursued national consolidation, constitutional monarchy, agrarian politics, and repeated wars over Macedonia and Thrace. The state oscillated between parliamentary forms, royal authority, coups, and revisionist nationalism."
Bulgaria,Communist Bulgaria,1944,1989,1,4,5,3,1,1,4,3,3,5,4,4,1,1,"The Fatherland Front and Soviet occupation brought one-party communist rule, collectivization, heavy industry, and close alignment with Moscow. Todor Zhivkov's long rule mixed bureaucratic stability, nationalist assimilation campaigns, and economic stagnation."
Bulgaria,Post-Communist Transition Bulgaria,1990,2007,3,3,3,3,3,3,3,3,4,4,3,4,3,0,"Post-communist Bulgaria oscillated between BSP (ex-communist) and SDS (anti-communist) governments through party fragmentation, hyperinflation and the 1996-97 currency crisis, the IMF currency-board stabilization, and EU/NATO accession negotiations."
Bulgaria,EU-Era Bulgaria,2007,2026,4,3,3,3,3,3,3,3,4,4,3,4,3,0,"EU accession in 2007 anchored Bulgaria in Western institutions but corruption and oligarchic capture persisted. Boyko Borisov's GERB dominated for over a decade, then collapsed amid 2020 anti-corruption protests; subsequent fragmentation produced repeated snap elections and unstable coalitions."
Slovakia,Habsburg Upper Hungary,1789,1917,4,4,3,3,3,2,3,2,3,3,4,3,1,0,"Slovak lands were part of the Kingdom of Hungary inside the Habsburg monarchy, shaped by Magyar noble dominance, Catholic and Lutheran communities, agrarian life, and a 19th-century Slovak national revival under pressure from Magyarization."
Slovakia,Czechoslovak Slovakia,1918,1938,3,3,3,3,4,4,3,3,3,4,3,4,0,0,"Within democratic Czechoslovakia, Slovakia gained education, bureaucracy, and infrastructure but many Slovaks saw Prague as centralizing and Czech-dominated. Agrarian, Catholic, and autonomist politics competed with Czechoslovak civic republicanism."
Slovakia,Wartime Slovak State,1939,1945,4,5,5,1,1,1,5,2,4,5,5,5,2,4,"The clerical-fascist Slovak State under Jozef Tiso was a Nazi client regime combining Catholic nationalism, authoritarian corporatism, antisemitic persecution, and wartime mobilization before the Slovak National Uprising and Soviet advance."
Slovakia,Communist/Federal Slovakia,1946,1992,1,4,4,3,2,2,4,3,3,4,4,4,1,0,"Postwar Slovakia returned to Czechoslovakia, then entered communist rule after 1948. Industrialization, collectivization, the Prague Spring's federalization, and normalization shaped a Slovak society increasingly ready for sovereign politics by 1992."
Slovakia,Mečiar Illiberal Slovakia,1993,2004,3,4,2,3,2,2,4,3,3,5,5,4,3,4,"Vladimír Mečiar's HZDS dominated the early independent Slovak state through patronage, media capture, and confrontation with EU institutions, leading to Slovakia's exclusion from the first wave of NATO/EU accession. Dzurinda's 1998 reform government reversed course and prepared for accession."
Slovakia,EU/NATO Slovakia,2004,2018,3,3,3,3,4,4,3,3,4,4,3,4,3,0,"EU and NATO membership stabilized Slovakia, with Dzurinda's reforms followed by Robert Fico's social-democratic populism (2006-2010, 2012-2018). Slovakia entered the eurozone in 2009, becoming the only V4 country to do so."
Slovakia,Fico-era Polarization,2018,2026,3,3,2,3,2,2,4,3,3,5,4,4,3,4,"The murder of journalist Ján Kuciak in 2018 forced Fico's resignation and ushered in a polarized cycle of anti-corruption (Matovič, Heger), Russia-friendly populism (Fico's return in 2023), and culture-war mobilization. The 2024 attempted assassination of Fico marked an unprecedented breakdown of political norms."
USA,Federalist Era,1789,1800,5,3,3,3,5,4,3,3,2,3,3,4,0,0,"Washington and Adams established constitutional governance under Federalist dominance, culminating in the controversial Alien and Sedition Acts."
USA,Jeffersonian,1801,1823,4,3,3,3,4,4,2,4,2,3,3,3,0,2,Republican ascendancy under Jefferson and successors expanded the nation through the Louisiana Purchase and weathered the War of 1812.
USA,Jacksonian Democracy,1824,1849,4,4,2,2,3,3,4,3,3,4,4,4,3,3,"Mass white-male democracy emerged alongside Indian Removal and Manifest Destiny, driven by populist energy and territorial ambition."
USA,Sectional Crisis,1850,1860,4,4,2,3,3,2,5,2,4,5,5,5,1,4,"Escalating conflict over slavery produced the Compromise of 1850, Kansas-Nebraska Act, and Dred Scott decision, making civil war increasingly inevitable."
USA,Civil War/Reconstruction,1861,1876,3,3,3,4,3,2,5,3,5,5,4,5,1,4,"The Union fought to end secession and slavery, followed by radical Reconstruction that briefly expanded Black citizenship before collapsing under Southern resistance."
USA,Gilded Age,1877,1895,5,4,2,2,3,3,4,3,2,4,4,3,0,0,Laissez-faire capitalism and industrial barons dominated while Jim Crow disenfranchised Black Americans and labor unrest grew.
USA,Progressive Era,1896,1919,3,3,3,4,4,3,3,4,4,4,3,4,0,5,"Theodore Roosevelt and Woodrow Wilson advanced antitrust regulation, women's suffrage, and international engagement through World War I."
USA,Roaring Twenties/Normalcy,1920,1932,5,4,2,3,3,3,3,3,2,3,3,3,1,0,"Harding and Coolidge restored laissez-faire normalcy amid cultural upheaval, Prohibition, and a speculative boom that ended in the Great Depression."
USA,New Deal/WWII,1933,1952,2,3,3,4,3,3,3,4,4,4,3,5,0,0,"FDR built the modern welfare state and led the arsenal of democracy through World War II, with Truman managing the early Cold War and desegregating the military."
USA,Cold War Consensus,1953,1968,3,3,3,4,4,4,3,4,2,4,3,4,0,0,Bipartisan containment policy under Eisenhower and JFK gave way to LBJ's Great Society and deepening Vietnam involvement.
USA,Crisis/Realignment,1969,1980,3,3,3,3,3,3,4,2,4,4,3,4,0,3,"Nixon's imperial presidency and Watergate scandal eroded institutional trust, while stagflation and the Carter malaise undermined economic confidence."
USA,Reagan-Clinton,1981,2007,4,3,3,3,4,3,3,3,2,4,3,4,0,0,"The conservative revolution and Third Way centrism defined a unipolar era of deregulation, globalization, and American hegemony."
USA,Polarization Era,2008,2026,3,3,3,3,3,1,4,2,4,5,4,5,3,4,"The financial crisis, Obama and Trump presidencies, and social media-driven hyperpolarization fractured the political consensus and eroded institutional trust."
Mexico,Late Colonial/Independence,1789,1821,4,4,2,3,2,2,4,3,5,3,4,4,2,4,"Bourbon reforms stoked colonial resentment, sparking the independence movements of Hidalgo and Morelos against Spanish rule."
Mexico,First Empire/Early Republic,1822,1854,4,4,2,2,2,2,4,2,4,3,4,4,3,4,"Iturbide's brief empire gave way to chronic instability under Santa Anna, with Mexico losing half its territory to the United States."
Mexico,La Reforma,1855,1876,3,2,3,4,3,2,4,4,5,4,3,5,0,5,"Benito Juarez enacted liberal Reform Laws separating Church and state, then led resistance against French-imposed Emperor Maximilian."
Mexico,Porfiriato,1877,1910,5,4,4,2,2,2,4,2,2,1,4,3,0,0,Porfirio Diaz's long dictatorship modernized infrastructure and attracted foreign investment while deepening inequality and suppressing dissent.
Mexico,Revolution,1911,1920,1,3,3,3,1,1,5,4,5,4,4,5,3,4,"A decade of revolutionary upheaval pitted Madero, Zapata, Villa, and Carranza against each other and the old order, killing over a million people."
Mexico,Revolutionary State,1921,1940,2,3,3,3,2,2,3,4,3,1,4,4,3,5,"The post-revolutionary state consolidated under Calles and Cardenas, who nationalized oil and distributed land to peasants."
Mexico,PRI Hegemony/Miracle,1941,1968,3,4,2,3,2,3,3,3,2,1,4,3,1,0,Single-party PRI rule delivered sustained economic growth and political stability through corporatist control and import substitution industrialization.
Mexico,PRI Crisis,1969,1988,3,4,2,3,2,2,4,2,4,1,4,3,1,0,"The 1968 Tlatelolco massacre shattered the regime's legitimacy, followed by oil boom-and-bust cycles and the devastating 1982 debt crisis."
Mexico,Democratization,1989,2012,4,3,3,3,3,3,3,3,3,4,3,4,0,0,"NAFTA integration and PAN's 2000 election victory ended one-party rule, but the drug war escalated into a major security crisis."
Mexico,AMLO/Morena,2013,2026,2,3,3,3,2,1,3,3,4,4,4,5,3,3,"Lopez Obrador's 'Fourth Transformation' brought populist left governance with centralized power, austerity for institutions, and expanded social transfers."
Brazil,Colonial/Portuguese Court,1789,1821,5,5,2,2,2,2,4,2,2,1,4,2,2,0,"The Inconfidencia Mineira failed to spark independence, but the Portuguese court's flight to Rio de Janeiro in 1808 transformed Brazil into the seat of empire."
Brazil,Empire,1822,1889,5,4,3,2,3,3,3,3,2,3,4,3,1,0,Pedro I declared independence and Pedro II presided over a stable constitutional monarchy sustained by slave labor until abolition in 1888 precipitated the republic.
Brazil,Old Republic,1889,1930,5,4,2,2,3,3,4,2,2,3,4,2,1,0,Coffee oligarchs from Sao Paulo and Minas Gerais rotated power through coronelismo and fraudulent elections in a decentralized federal system.
Brazil,Vargas Era,1930,1945,2,4,2,3,2,1,3,3,4,1,4,4,1,4,"Getulio Vargas seized power, established the Estado Novo corporatist dictatorship, and launched state-led industrialization with labor co-optation."
Brazil,Democratic Experiment,1946,1963,3,3,3,3,3,3,3,4,3,4,3,4,0,5,Competitive democracy returned with populist leaders and Juscelino Kubitschek's ambitious modernization program that built Brasilia as the new capital.
Brazil,Military Dictatorship,1964,1984,4,4,4,2,2,1,4,1,3,1,4,3,1,1,"Military generals ruled through repression and the economic 'miracle' of high growth, but left a legacy of inequality, debt, and human rights abuses."
Brazil,Redemocratization,1985,2002,3,2,4,4,4,4,3,4,3,4,2,4,0,0,"The New Republic brought a progressive 1988 constitution, and Fernando Henrique Cardoso's Real Plan finally tamed hyperinflation."
Brazil,Lula/PT Era,2003,2015,2,2,4,4,3,3,2,4,3,4,3,4,0,3,"Lula's Workers' Party expanded social programs like Bolsa Familia during a commodity boom, but the era ended in massive corruption scandals."
Brazil,Bolsonaro/Crisis,2016,2026,4,5,2,2,2,1,4,1,4,5,5,5,3,4,"Dilma's impeachment opened the door to Bolsonaro's far-right populism, deepening polarization amid institutional crisis and pandemic mismanagement."
Argentina,Independence/Rivadavia,1810,1829,4,3,3,3,3,3,3,4,4,3,3,4,0,5,"The May Revolution launched Argentine independence, and Rivadavia's short-lived presidency attempted liberal reforms from Buenos Aires."
